{
  "schema_version": 1,
  "status": "proposal_not_loaded_by_game",
  "id": "desert_phase_06",
  "campaign_id": "desert_campaign",
  "realm_id": "desert",
  "order": 6,
  "name": "Tempestade de Areia",
  "narrative_description": "Uma tempestade encobre a aproximação da fortaleza; abrigos e marcos guiam El Fuego.",
  "environment": "Areia em movimento, abrigos rochosos e contraste suficiente para orientação.",
  "protagonist_id": "el_fuego",
  "difficulty": {
    "progression_rank": 6,
    "label": "moderada a alta",
    "balance_status": "not_playtested"
  },
  "obstacle_types_planned": [
    "shelter_routes",
    "reduced_visibility_with_markers",
    "wind_windows_planned"
  ],
  "enemies_planned": [
    {
      "character_id": "cactus",
      "role": "desert_troop",
      "placement_status": "not_defined"
    }
  ],
  "boss_id": null,
  "prerequisite_phase_ids": [
    "desert_phase_05"
  ],
  "checkpoints_planned": [
    {
      "id": "desert_phase_06_checkpoint_01",
      "location_description": "No abrigo antes da área aberta",
      "implementation_status": "not_implemented"
    },
    {
      "id": "desert_phase_06_checkpoint_02",
      "location_description": "Depois do principal corredor da tempestade",
      "implementation_status": "not_implemented"
    }
  ],
  "completion": {
    "type": "reach_exit",
    "required_boss_id": null,
    "persisted_by": "future_verified_progress_service",
    "checkpoint_is_completion": false
  },
  "future_rewards": [
    {
      "type": "phase_completion",
      "target_id": "desert_phase_06",
      "status": "future"
    },
    {
      "type": "next_phase_access",
      "target_id": "desert_phase_07",
      "status": "future"
    }
  ],
  "resources_required": [
    "el_fuego_model",
    "cactus_model",
    "checkpoint_presentation",
    "desert_audio",
    "desert_story_text",
    "desert_sandstorm",
    "desert_dunes"
  ],
  "implementation_dependencies": [
    "campaign_navigation",
    "level_builder",
    "checkpoint_system",
    "phase_progression",
    "cactus_reuse",
    "asset_import_validation",
    "playtest_and_accessibility",
    "sandstorm_effect"
  ],
  "existing_runtime": {
    "scene": null,
    "config": null,
    "status": "not_implemented"
  }
}
