{
  "schema_version": 1,
  "status": "proposal_not_loaded_by_game",
  "id": "desert_phase_02",
  "campaign_id": "desert_campaign",
  "realm_id": "desert",
  "order": 2,
  "name": "Dunas Perdidas",
  "narrative_description": "As trilhas desaparecem entre dunas; El Fuego segue marcos antigos para reencontrar o caminho.",
  "environment": "Dunas escalonadas, rochas expostas e horizonte com marcos visuais.",
  "protagonist_id": "el_fuego",
  "difficulty": {
    "progression_rank": 2,
    "label": "fácil",
    "balance_status": "not_playtested"
  },
  "obstacle_types_planned": [
    "staggered_ledges",
    "alternating_gaps",
    "route_landmarks"
  ],
  "enemies_planned": [
    {
      "character_id": "cactus",
      "role": "desert_troop",
      "placement_status": "not_defined"
    }
  ],
  "boss_id": null,
  "prerequisite_phase_ids": [
    "desert_phase_01"
  ],
  "checkpoints_planned": [
    {
      "id": "desert_phase_02_checkpoint_01",
      "location_description": "Na chegada ao primeiro marco estável",
      "implementation_status": "not_implemented"
    },
    {
      "id": "desert_phase_02_checkpoint_02",
      "location_description": "Depois da travessia central de dunas",
      "implementation_status": "not_implemented"
    }
  ],
  "completion": {
    "type": "reach_exit",
    "required_boss_id": null,
    "persisted_by": "future_verified_progress_service",
    "checkpoint_is_completion": false
  },
  "future_rewards": [
    {
      "type": "phase_completion",
      "target_id": "desert_phase_02",
      "status": "future"
    },
    {
      "type": "next_phase_access",
      "target_id": "desert_phase_03",
      "status": "future"
    }
  ],
  "resources_required": [
    "el_fuego_model",
    "cactus_model",
    "checkpoint_presentation",
    "desert_audio",
    "desert_story_text",
    "desert_dunes"
  ],
  "implementation_dependencies": [
    "campaign_navigation",
    "level_builder",
    "checkpoint_system",
    "phase_progression",
    "cactus_reuse",
    "asset_import_validation",
    "playtest_and_accessibility"
  ],
  "existing_runtime": {
    "scene": null,
    "config": null,
    "status": "not_implemented"
  }
}
