{
  "schema_version": 1,
  "status": "proposal_not_loaded_by_game",
  "id": "desert_phase_03",
  "campaign_id": "desert_campaign",
  "realm_id": "desert",
  "order": 3,
  "name": "Oásis da Meia-Noite",
  "narrative_description": "No oásis, El Fuego encontra indícios de que as patrulhas recebem ordens de uma fortaleza.",
  "environment": "Água noturna, reflexos contidos e plataformas nas margens.",
  "protagonist_id": "el_fuego",
  "difficulty": {
    "progression_rank": 3,
    "label": "fácil a moderada",
    "balance_status": "not_playtested"
  },
  "obstacle_types_planned": [
    "shore_gaps",
    "narrow_safe_paths",
    "patrol_crossings"
  ],
  "enemies_planned": [
    {
      "character_id": "cactus",
      "role": "desert_troop",
      "placement_status": "not_defined"
    }
  ],
  "boss_id": null,
  "prerequisite_phase_ids": [
    "desert_phase_02"
  ],
  "checkpoints_planned": [
    {
      "id": "desert_phase_03_checkpoint_01",
      "location_description": "Na margem segura do oásis",
      "implementation_status": "not_implemented"
    },
    {
      "id": "desert_phase_03_checkpoint_02",
      "location_description": "Após a rota sobre as ilhas",
      "implementation_status": "not_implemented"
    }
  ],
  "completion": {
    "type": "reach_exit",
    "required_boss_id": null,
    "persisted_by": "future_verified_progress_service",
    "checkpoint_is_completion": false
  },
  "future_rewards": [
    {
      "type": "phase_completion",
      "target_id": "desert_phase_03",
      "status": "future"
    },
    {
      "type": "next_phase_access",
      "target_id": "desert_phase_04",
      "status": "future"
    }
  ],
  "resources_required": [
    "el_fuego_model",
    "cactus_model",
    "checkpoint_presentation",
    "desert_audio",
    "desert_story_text",
    "desert_oasis"
  ],
  "implementation_dependencies": [
    "campaign_navigation",
    "level_builder",
    "checkpoint_system",
    "phase_progression",
    "cactus_reuse",
    "asset_import_validation",
    "playtest_and_accessibility"
  ],
  "existing_runtime": {
    "scene": null,
    "config": null,
    "status": "not_implemented"
  }
}
